No.     Time           Source                Destination           Protocol Length Info
      4 0.070340       192.168.1.224         93.184.216.34         TLSv1.2  285    Client Hello

Frame 4: 285 bytes on wire (2280 bits), 285 bytes captured (2280 bits)
Ethernet II, Src: IntelCor_3b:8a:e4 (94:65:9c:3b:8a:e4), Dst: AskeyCom_84:6f:b2 (7c:db:98:84:6f:b2)
Internet Protocol Version 4, Src: 192.168.1.224, Dst: 93.184.216.34
Transmission Control Protocol, Src Port: 65260, Dst Port: 443, Seq: 1, Ack: 1, Len: 219
Transport Layer Security

No.     Time           Source                Destination           Protocol Length Info
      6 0.144654       93.184.216.34         192.168.1.224         TLSv1.2  1514   Server Hello

Frame 6: 1514 bytes on wire (12112 bits), 1514 bytes captured (12112 bits)
Ethernet II, Src: AskeyCom_84:6f:b2 (7c:db:98:84:6f:b2), Dst: IntelCor_3b:8a:e4 (94:65:9c:3b:8a:e4)
Internet Protocol Version 4, Src: 93.184.216.34, Dst: 192.168.1.224
Transmission Control Protocol, Src Port: 443, Dst Port: 65260, Seq: 1, Ack: 220, Len: 1448
Transport Layer Security

No.     Time           Source                Destination           Protocol Length Info
      9 0.145791       93.184.216.34         192.168.1.224         TLSv1.2  1266   Certificate [TCP segment of a reassembled PDU]

Frame 9: 1266 bytes on wire (10128 bits), 1266 bytes captured (10128 bits)
Ethernet II, Src: AskeyCom_84:6f:b2 (7c:db:98:84:6f:b2), Dst: IntelCor_3b:8a:e4 (94:65:9c:3b:8a:e4)
Internet Protocol Version 4, Src: 93.184.216.34, Dst: 192.168.1.224
Transmission Control Protocol, Src Port: 443, Dst Port: 65260, Seq: 2897, Ack: 220, Len: 1200
[3 Reassembled TCP Segments (3983 bytes): #6(1346), #8(1448), #9(1189)]
Transport Layer Security

No.     Time           Source                Destination           Protocol Length Info
     10 0.145795       93.184.216.34         192.168.1.224         TLSv1.2  886    Certificate Status, Server Key Exchange, Server Hello Done

Frame 10: 886 bytes on wire (7088 bits), 886 bytes captured (7088 bits)
Ethernet II, Src: AskeyCom_84:6f:b2 (7c:db:98:84:6f:b2), Dst: IntelCor_3b:8a:e4 (94:65:9c:3b:8a:e4)
Internet Protocol Version 4, Src: 93.184.216.34, Dst: 192.168.1.224
Transmission Control Protocol, Src Port: 443, Dst Port: 65260, Seq: 4097, Ack: 220, Len: 820
[2 Reassembled TCP Segments (484 bytes): #9(11), #10(473)]
Transport Layer Security
Transport Layer Security

No.     Time           Source                Destination           Protocol Length Info
     13 0.149297       192.168.1.224         93.184.216.34         TLSv1.2  192    Client Key Exchange, Change Cipher Spec, Encrypted Handshake Message

Frame 13: 192 bytes on wire (1536 bits), 192 bytes captured (1536 bits)
Ethernet II, Src: IntelCor_3b:8a:e4 (94:65:9c:3b:8a:e4), Dst: AskeyCom_84:6f:b2 (7c:db:98:84:6f:b2)
Internet Protocol Version 4, Src: 192.168.1.224, Dst: 93.184.216.34
Transmission Control Protocol, Src Port: 65260, Dst Port: 443, Seq: 220, Ack: 4917, Len: 126
Transport Layer Security

No.     Time           Source                Destination           Protocol Length Info
     14 0.218127       93.184.216.34         192.168.1.224         TLSv1.2  117    Change Cipher Spec, Encrypted Handshake Message

Frame 14: 117 bytes on wire (936 bits), 117 bytes captured (936 bits)
Ethernet II, Src: AskeyCom_84:6f:b2 (7c:db:98:84:6f:b2), Dst: IntelCor_3b:8a:e4 (94:65:9c:3b:8a:e4)
Internet Protocol Version 4, Src: 93.184.216.34, Dst: 192.168.1.224
Transmission Control Protocol, Src Port: 443, Dst Port: 65260, Seq: 4917, Ack: 346, Len: 51
Transport Layer Security

No.     Time           Source                Destination           Protocol Length Info
     16 0.232577       192.168.1.224         93.184.216.34         TLSv1.2  97     Encrypted Alert

Frame 16: 97 bytes on wire (776 bits), 97 bytes captured (776 bits)
Ethernet II, Src: IntelCor_3b:8a:e4 (94:65:9c:3b:8a:e4), Dst: AskeyCom_84:6f:b2 (7c:db:98:84:6f:b2)
Internet Protocol Version 4, Src: 192.168.1.224, Dst: 93.184.216.34
Transmission Control Protocol, Src Port: 65260, Dst Port: 443, Seq: 346, Ack: 4968, Len: 31
Transport Layer Security

No.     Time           Source                Destination           Protocol Length Info
     18 0.298212       93.184.216.34         192.168.1.224         TLSv1.2  97     Encrypted Alert

Frame 18: 97 bytes on wire (776 bits), 97 bytes captured (776 bits)
Ethernet II, Src: AskeyCom_84:6f:b2 (7c:db:98:84:6f:b2), Dst: IntelCor_3b:8a:e4 (94:65:9c:3b:8a:e4)
Internet Protocol Version 4, Src: 93.184.216.34, Dst: 192.168.1.224
Transmission Control Protocol, Src Port: 443, Dst Port: 65260, Seq: 4968, Ack: 377, Len: 31
Transport Layer Security